{
  "$schema": "https://json-schema.org/draft/2020-12/schema",
  "$id": "https://godot-agent-harness.local/specs/003-editor-evidence-loop/contracts/automation-run-request.schema.json",
  "title": "Automation Run Request",
  "type": "object",
  "additionalProperties": false,
  "required": [
    "requestId",
    "scenarioId",
    "runId",
    "outputDirectory",
    "artifactRoot",
    "expectationFiles",
    "capturePolicy",
    "stopPolicy",
    "requestedBy",
    "createdAt"
  ],
  "properties": {
    "requestId": {
      "type": "string",
      "minLength": 1
    },
    "scenarioId": {
      "type": "string",
      "minLength": 1
    },
    "runId": {
      "type": "string",
      "minLength": 1
    },
    "targetScene": {
      "type": "string",
      "minLength": 1
    },
    "outputDirectory": {
      "type": "string",
      "minLength": 1
    },
    "artifactRoot": {
      "type": "string"
    },
    "expectationFiles": {
      "type": "array",
      "items": {
        "type": "string",
        "minLength": 1
      }
    },
    "capturePolicy": {
      "$ref": "#/$defs/capturePolicy"
    },
    "stopPolicy": {
      "$ref": "#/$defs/stopPolicy"
    },
    "requestedBy": {
      "type": "string",
      "minLength": 1
    },
    "createdAt": {
      "type": "string",
      "format": "date-time"
    },
    "behaviorWatchRequest": {
      "$ref": "#/$defs/behaviorWatchRequest"
    },
    "inputDispatchScript": {
      "$ref": "#/$defs/inputDispatchScript"
    },
    "overrides": {
      "type": "object",
      "additionalProperties": false,
      "properties": {
        "targetScene": {
          "type": "string",
          "minLength": 1
        },
        "outputDirectory": {
          "type": "string",
          "minLength": 1
        },
        "artifactRoot": {
          "type": "string"
        },
        "expectationFiles": {
          "type": "array",
          "items": {
            "type": "string",
            "minLength": 1
          }
        },
        "capturePolicy": {
          "$ref": "#/$defs/capturePolicy"
        },
        "stopPolicy": {
          "$ref": "#/$defs/stopPolicy"
        },
        "behaviorWatchRequest": {
          "$ref": "#/$defs/behaviorWatchRequest"
        },
        "inputDispatchScript": {
          "$ref": "#/$defs/inputDispatchScript"
        }
      }
    }
  },
  "$defs": {
    "capturePolicy": {
      "type": "object",
      "additionalProperties": false,
      "required": ["startup", "manual", "failure"],
      "properties": {
        "startup": {
          "type": "boolean"
        },
        "manual": {
          "type": "boolean"
        },
        "failure": {
          "type": "boolean"
        }
      }
    },
    "stopPolicy": {
      "type": "object",
      "additionalProperties": false,
      "required": ["stopAfterValidation"],
      "properties": {
        "stopAfterValidation": {
          "type": "boolean"
        },
        "minRuntimeFrames": {
          "type": "integer",
          "minimum": 0,
          "default": 0,
          "description": "Pass 8b: minimum process frames Engine.get_process_frames() must reach before the startup capture (and the validation-pass stop it gates) fires. Default 0 preserves pre-8b behavior; runtime-error-triage workflows set 30 (~0.5s at 60fps) to give user _process code a window to fire so its errors are captured."
        }
      }
    },
    "behaviorWatchRequest": {
      "type": "object",
      "additionalProperties": false,
      "required": [
        "targets",
        "frameCount"
      ],
      "properties": {
        "targets": {
          "type": "array",
          "minItems": 1,
          "items": {
            "$ref": "#/$defs/watchTarget"
          }
        },
        "cadence": {
          "$ref": "#/$defs/watchCadence"
        },
        "startFrameOffset": {
          "type": "integer",
          "minimum": 0
        },
        "frameCount": {
          "type": "integer",
          "minimum": 1
        }
      }
    },
    "watchTarget": {
      "type": "object",
      "additionalProperties": false,
      "required": [
        "nodePath",
        "properties"
      ],
      "properties": {
        "nodePath": {
          "type": "string",
          "pattern": "^/.*",
          "minLength": 2
        },
        "properties": {
          "type": "array",
          "minItems": 1,
          "uniqueItems": true,
          "items": {
            "type": "string",
            "enum": [
              "position",
              "velocity",
              "intendedVelocity",
              "collisionState",
              "lastCollider",
              "movementVector",
              "speed",
              "overlapFrames"
            ]
          }
        }
      }
    },
    "watchCadence": {
      "type": "object",
      "additionalProperties": false,
      "required": [
        "mode"
      ],
      "properties": {
        "mode": {
          "type": "string",
          "enum": [
            "every_frame",
            "every_n_frames"
          ]
        },
        "everyNFrames": {
          "type": "integer",
          "minimum": 2
        }
      },
      "allOf": [
        {
          "if": {
            "properties": {
              "mode": {
                "const": "every_frame"
              }
            }
          },
          "then": {
            "not": {
              "required": [
                "everyNFrames"
              ]
            }
          }
        },
        {
          "if": {
            "properties": {
              "mode": {
                "const": "every_n_frames"
              }
            }
          },
          "then": {
            "required": [
              "everyNFrames"
            ]
          }
        }
      ]
    },
    "inputDispatchScript": {
      "type": "object",
      "additionalProperties": false,
      "required": [
        "events"
      ],
      "properties": {
        "events": {
          "type": "array",
          "minItems": 1,
          "maxItems": 256,
          "items": {
            "$ref": "#/$defs/inputDispatchEvent"
          }
        }
      }
    },
    "inputDispatchEvent": {
      "type": "object",
      "additionalProperties": false,
      "required": [
        "kind",
        "identifier",
        "phase",
        "frame"
      ],
      "properties": {
        "kind": {
          "type": "string",
          "enum": [
            "key",
            "action"
          ]
        },
        "identifier": {
          "type": "string",
          "minLength": 1
        },
        "phase": {
          "type": "string",
          "enum": [
            "press",
            "release"
          ]
        },
        "frame": {
          "type": "integer",
          "minimum": 0
        },
        "order": {
          "type": "integer",
          "minimum": 0
        }
      }
    }
  }
}
