{
  "requestId": "pong-request-healthy-001",
  "scenarioId": "pong-scenegraph-happy-path",
  "runId": "pong-autonomous-run-001",
  "targetScene": "res://scenes/main.tscn",
  "outputDirectory": "res://evidence/automation/pong-autonomous-run-001",
  "artifactRoot": "tools/tests/fixtures/pong-testbed/evidence/automation/pong-autonomous-run-001",
  "expectationFiles": [
    "res://harness/expectations/common.json"
  ],
  "capturePolicy": {
    "startup": true,
    "manual": true,
    "failure": true
  },
  "stopPolicy": {
    "stopAfterValidation": true
  },
  "requestedBy": "scenegraph-automation-fixture",
  "createdAt": "2026-04-12T12:12:00Z",
  "overrides": {
    "outputDirectory": "res://evidence/automation/pong-autonomous-run-001"
  }
}
